PUESTO_SIMPLIFICADO,PUESTO,CARGO ADMINISTRATIVO,CONTEO,Simp_puesto,Puesto_cargo,Simp_cargo
TECNICO,TECNICO ESPECIALIZADO B,TÉCNICO DE LABORATORIO DE ARQUEOLOGÍA,2,FALSO,FALSO,FALSO
TECNICO,TECNICO ESPECIALIZADO B,TÉCNICO DE LABORATORIO DE BOTÁNICA Y MICOLOGÍA,12,FALSO,FALSO,FALSO
TECNICO,TECNICO ESPECIALIZADO B,TÉCNICO DE LABORATORIO DE COLECCIONES DE PECES Y LARVAS DE PECES,12,FALSO,FALSO,FALSO
TECNICO,TECNICO ESPECIALIZADO B,TÉCNICO DE LABORATORIO DE GEOTECNIA,12,FALSO,FALSO,FALSO
TECNICO,TECNICO ESPECIALIZADO B,TÉCNICO DE LABORATORIO DE INGENIERÍA QUÍMICA,12,FALSO,FALSO,FALSO
TECNICO,TECNICO ESPECIALIZADO B,TÉCNICO DE LABORATORIO DE MICROALGAS,12,FALSO,FALSO,FALSO
TECNICO,TECNICO ESPECIALIZADO B,TÉCNICO DE LABORATORIO DE SISMOLOGÍA,12,FALSO,FALSO,FALSO
TECNICO,TECNICO ESPECIALIZADO B,TÉCNICO DE LABORATORIO DE VIROLOGÍA,12,FALSO,FALSO,FALSO
TECNICO,TECNICO ESPECIALIZADO B,TÉCNICO DE LABORATORIO EN ALIMENTOS PARA ANIMALES,24,FALSO,FALSO,FALSO
TECNICO,TECNICO ESPECIALIZADO B,TÉCNICO DE LABORATORIO EN ANATOMÍA,12,FALSO,FALSO,FALSO
TECNICO,TECNICO ESPECIALIZADO B,TÉCNICO DE LABORATORIO EN BIOLOGÍA,38,FALSO,FALSO,FALSO
TECNICO,TECNICO ESPECIALIZADO B,TÉCNICO DE LABORATORIO EN BIOLOGÍA MOLECULAR,12,FALSO,FALSO,FALSO
TECNICO,TECNICO ESPECIALIZADO B,TÉCNICO DE LABORATORIO EN BIOTECNOLOGÍA DE PLANTAS,12,FALSO,FALSO,FALSO
TECNICO,TECNICO ESPECIALIZADO B,TÉCNICO DE LABORATORIO EN ENFERMEDADES TROPICALES,12,FALSO,FALSO,FALSO
TECNICO,TECNICO ESPECIALIZADO B,TÉCNICO DE LABORATORIO EN ESPECTROMETRÍA GAMMA,12,FALSO,FALSO,FALSO
TECNICO,TECNICO ESPECIALIZADO B,TÉCNICO DE LABORATORIO EN FARMACOGNOSIA,12,FALSO,FALSO,FALSO
TECNICO,TECNICO ESPECIALIZADO B,TÉCNICO DE LABORATORIO EN GRANOS Y SEMILLAS,36,FALSO,FALSO,FALSO
TECNICO,TECNICO ESPECIALIZADO B,TÉCNICO DE LABORATORIO EN INVESTIGACIONES AGRONÓMICAS,17,FALSO,FALSO,FALSO
TECNICO,TECNICO ESPECIALIZADO B,TÉCNICO DE LABORATORIO EN MEDICINA,50,FALSO,FALSO,FALSO
TECNICO,TECNICO ESPECIALIZADO B,TÉCNICO DE LABORATORIO EN MICROSCOPÍA ELECTRÓNICA,12,FALSO,FALSO,FALSO
TECNICO,TECNICO ESPECIALIZADO B,TÉCNICO DE LABORATORIO EN MOVIMIENTO HUMANO,12,FALSO,FALSO,FALSO
TECNICO,TECNICO ESPECIALIZADO B,TÉCNICO DE LABORATORIO EN MUESTRAS SANGUÍNEAS,24,FALSO,FALSO,FALSO
TECNICO,TECNICO ESPECIALIZADO B,TÉCNICO DE LABORATORIO EN NEUROCIENCIAS,24,FALSO,FALSO,FALSO
TECNICO,TECNICO ESPECIALIZADO B,TÉCNICO DE LABORATORIO EN PREPARACIÓN DE MUESTRAS HISTOLÓGICAS,24,FALSO,FALSO,FALSO
TECNICO,TECNICO ESPECIALIZADO B,TÉCNICO DE LABORATORIO EN PRESERVACIÓN DE MUESTRAS BIOLÓGICAS,12,FALSO,FALSO,FALSO
TECNICO,TECNICO ESPECIALIZADO B,TÉCNICO DE LABORATORIO EN QUÍMICA,140,FALSO,FALSO,FALSO
TECNICO,TECNICO ESPECIALIZADO B,TÉCNICO DE LABORATORIO EN QUÍMICA DE SUELOS,12,FALSO,FALSO,FALSO
TECNICO,TECNICO ESPECIALIZADO B,TÉCNICO DE LABORATORIO EN QUÍMICA DE TECNOLOGÍA DE ALIMENTOS,12,FALSO,FALSO,FALSO
TECNICO,TECNICO ESPECIALIZADO B,TÉCNICO DE LABORATORIO EN SUEROS,12,FALSO,FALSO,FALSO
TECNICO,TECNICO ESPECIALIZADO B,TÉCNICO DE LABORATORIO EN TECNOLOGÍA DE ALIMENTOS,60,FALSO,FALSO,FALSO
TECNICO,TECNICO ESPECIALIZADO B,TÉCNICO EN ADMISIÓN ESTUDIANTIL,12,FALSO,FALSO,FALSO
TECNICO,TECNICO ESPECIALIZADO B,TÉCNICO EN ALMACENAMIENTO Y DISTRIBUCIÓN DE BIENES,12,FALSO,FALSO,FALSO
TECNICO,TECNICO ESPECIALIZADO B,TÉCNICO EN APOYO A ADMISIÓN Y MATRÍCULA,71,FALSO,FALSO,FALSO
TECNICO,TECNICO ESPECIALIZADO B,TÉCNICO EN APOYO A COORDINACIÓN ADMINISTRATIVA DE LA OSG,12,FALSO,FALSO,FALSO
TECNICO,TECNICO ESPECIALIZADO B,TÉCNICO EN APOYO A EXPEDIENTES Y CERTIFICACIONES,48,FALSO,FALSO,FALSO
TECNICO,TECNICO ESPECIALIZADO B,TÉCNICO EN APOYO A GRADUACIONES ESTUDIANTILES,10,FALSO,FALSO,FALSO
TECNICO,TECNICO ESPECIALIZADO B,TÉCNICO EN APOYO A LA GESTIÓN DE VICERRECTORIA DE ADMINISTRACIÓN,24,FALSO,FALSO,FALSO
TECNICO,TECNICO ESPECIALIZADO B,TÉCNICO EN APOYO A LA GESTIÓN DE VICERRECTORÍA DE DOCENCIA,12,FALSO,FALSO,FALSO
TECNICO,TECNICO ESPECIALIZADO B,TÉCNICO EN APOYO A LA INVESTIGACIÓN DE PROYECTOS BIOMÉDICOS,12,FALSO,FALSO,FALSO
TECNICO,TECNICO ESPECIALIZADO B,TÉCNICO EN APOYO A LA INVESTIGACIÓN EN SALUD,72,FALSO,FALSO,FALSO
TECNICO,TECNICO ESPECIALIZADO B,TÉCNICO EN APOYO A LA INVESTIGACIÓN EN ÁREAS PROTEGIDAS,12,FALSO,FALSO,FALSO
TECNICO,TECNICO ESPECIALIZADO B,TÉCNICO EN APOYO A LOS PROCESOS DE DOCENCIA DE SEDE DEL ATLÁNTICO,12,FALSO,FALSO,FALSO
TECNICO,TECNICO ESPECIALIZADO B,TÉCNICO EN APOYO A LOS PROCESOS DE RECURSOS HUMANOS DE SEDE,12,FALSO,FALSO,FALSO
TECNICO,TECNICO ESPECIALIZADO B,TÉCNICO EN APOYO A MICROBIOLOGÍA DE AGUAS,1,FALSO,FALSO,FALSO
TECNICO,TECNICO ESPECIALIZADO B,TÉCNICO EN APOYO A SERVICIOS ADMINISTRATIVOS Y ESTUDIANTILES,44,FALSO,FALSO,FALSO
TECNICO,TECNICO ESPECIALIZADO B,TÉCNICO EN APOYO A SERVICIOS DE TRANSPORTE,12,FALSO,FALSO,FALSO
TECNICO,TECNICO ESPECIALIZADO B,TÉCNICO EN APOYO A VIROLOGÍA MÉDICA,12,FALSO,FALSO,FALSO
TECNICO,TECNICO ESPECIALIZADO B,TÉCNICO EN APOYO ADMINISTRATIVO A PROYECTOS DE INVESTIGACIÓN DEL CICA,12,FALSO,FALSO,FALSO
TECNICO,TECNICO ESPECIALIZADO B,TÉCNICO EN APOYO ADMINISTRATIVO DE BODEGAS,12,FALSO,FALSO,FALSO
TECNICO,TECNICO ESPECIALIZADO B,TÉCNICO EN APOYO ADMINISTRATIVO DE CAJAS,23,FALSO,FALSO,FALSO
TECNICO,TECNICO ESPECIALIZADO B,TÉCNICO EN APOYO ADMINISTRATIVO DE DIRECCIÓN,12,FALSO,FALSO,FALSO
TECNICO,TECNICO ESPECIALIZADO B,TÉCNICO EN APOYO ADMINISTRATIVO DE MAQUINARIA Y EQUIPO,12,FALSO,FALSO,FALSO
TECNICO,TECNICO ESPECIALIZADO B,TÉCNICO EN APOYO AL PROCESO DE DANZA UNIVERSITARIA,12,FALSO,FALSO,FALSO
TECNICO,TECNICO ESPECIALIZADO B,TÉCNICO EN APOYO AL PROCESO DE RÉGIMEN ACADÉMICO,12,FALSO,FALSO,FALSO
TECNICO,TECNICO ESPECIALIZADO B,TÉCNICO EN APOYO AL PROCESO DE VACACIONES,24,FALSO,FALSO,FALSO
TECNICO,TECNICO ESPECIALIZADO B,TÉCNICO EN ASIGNACIÓN DE BECAS DE ESTÍMULO,24,FALSO,FALSO,FALSO
TECNICO,TECNICO ESPECIALIZADO B,TÉCNICO EN ASISTENCIA DENTAL,360,FALSO,FALSO,FALSO
TECNICO,TECNICO ESPECIALIZADO B,TÉCNICO EN ASUNTOS DELICTIVOS,24,FALSO,FALSO,FALSO
TECNICO,TECNICO ESPECIALIZADO B,TÉCNICO EN ASUNTOS ESTUDIANTILES DEL SEP,24,FALSO,FALSO,FALSO
TECNICO,TECNICO ESPECIALIZADO B,TÉCNICO EN BIBLIOTECOLOGÍA,1066,FALSO,FALSO,FALSO
TECNICO,TECNICO ESPECIALIZADO B,TÉCNICO EN CERTIFICACIONES Y CONSTANCIAS DE SALARIO Y PENSIÓN,7,FALSO,FALSO,FALSO
TECNICO,TECNICO ESPECIALIZADO B,TÉCNICO EN COMPRA DE RECURSOS BIBLIOGRÁFICOS,9,FALSO,FALSO,FALSO
TECNICO,TECNICO ESPECIALIZADO B,TÉCNICO EN COMPRAS ESPECIALIZADAS,66,FALSO,FALSO,FALSO
TECNICO,TECNICO ESPECIALIZADO B,TÉCNICO EN CONTROL DE EJECUCIÓN PRESUPUESTARIA,12,FALSO,FALSO,FALSO
TECNICO,TECNICO ESPECIALIZADO B,TÉCNICO EN CONTROL DE FLOTILLA VEHÍCULAR,12,FALSO,FALSO,FALSO
TECNICO,TECNICO ESPECIALIZADO B,TÉCNICO EN CONTROL DE MATERIALES Y ACTIVOS,12,FALSO,FALSO,FALSO
TECNICO,TECNICO ESPECIALIZADO B,TÉCNICO EN CONTROL DE PUBLICACIONES PERIÓDICAS,12,FALSO,FALSO,FALSO
TECNICO,TECNICO ESPECIALIZADO B,TÉCNICO EN DIAGRAMACIÓN Y SERVICIO DE AUDIO,12,FALSO,FALSO,FALSO
TECNICO,TECNICO ESPECIALIZADO B,TÉCNICO EN DIBUJO DE PLANOS CONSTRUCTIVOS,59,FALSO,FALSO,FALSO
TECNICO,TECNICO ESPECIALIZADO B,TÉCNICO EN DISEÑO GRÁFICO,180,FALSO,FALSO,FALSO
TECNICO,TECNICO ESPECIALIZADO B,TÉCNICO EN DONACIÓN Y DEPÓSITOS DE RECURSOS BIBLIOGRÁFICOS,12,FALSO,FALSO,FALSO
TECNICO,TECNICO ESPECIALIZADO B,TÉCNICO EN ENSAYOS DE INFRAESTRUCTURAS CIVIL Y VIAL,24,FALSO,FALSO,FALSO
TECNICO,TECNICO ESPECIALIZADO B,TÉCNICO EN ETIQUETADO Y EMPAQUE DE ANTIVENENOS,12,FALSO,FALSO,FALSO
TECNICO,TECNICO ESPECIALIZADO B,TÉCNICO EN GESTIÓN ADMINISTRATIVA DE LA ESCUELA DE QUÍMICA,12,FALSO,FALSO,FALSO
TECNICO,TECNICO ESPECIALIZADO B,TÉCNICO EN GESTIÓN ADMINISTRATIVA DEL SEP,12,FALSO,FALSO,FALSO
TECNICO,TECNICO ESPECIALIZADO B,TÉCNICO EN GESTIÓN DE GRADUACIONES DE SEDE DE OCCIDENTE,12,FALSO,FALSO,FALSO
TECNICO,TECNICO ESPECIALIZADO B,TÉCNICO EN GESTIÓN DE MOVIMIENTOS DE PERSONAL,48,FALSO,FALSO,FALSO
TECNICO,TECNICO ESPECIALIZADO B,TÉCNICO EN GESTIÓN DE POSGRADOS B,204,FALSO,FALSO,FALSO
TECNICO,TECNICO ESPECIALIZADO B,TÉCNICO EN GESTIÓN MUNICIPAL,12,FALSO,FALSO,FALSO
TECNICO,TECNICO ESPECIALIZADO B,TÉCNICO EN GRABACIÓN AUDIOVISUAL DE ARTES DRAMÁTICAS,12,FALSO,FALSO,FALSO
TECNICO,TECNICO ESPECIALIZADO B,TÉCNICO EN GRADUACIONES DE HONOR,12,FALSO,FALSO,FALSO
TECNICO,TECNICO ESPECIALIZADO B,TÉCNICO EN IMPRESIÓN,141,FALSO,FALSO,FALSO
TECNICO,TECNICO ESPECIALIZADO B,TÉCNICO EN INSCRIPCIÓN DE RECURSOS BIBLIOGRÁFICOS,5,FALSO,FALSO,FALSO
TECNICO,TECNICO ESPECIALIZADO B,TÉCNICO EN MANEJO DE ANIMALES DE LABORATORIO,48,FALSO,FALSO,FALSO
TECNICO,TECNICO ESPECIALIZADO B,TÉCNICO EN MANTENIMIENTO DE ACELERÓGRAFOS,23,FALSO,FALSO,FALSO
TECNICO,TECNICO ESPECIALIZADO B,TÉCNICO EN MANTENIMIENTO DE EQUIPO,158,FALSO,FALSO,FALSO
TECNICO,TECNICO ESPECIALIZADO B,TÉCNICO EN MANTENIMIENTO DE EQUIPO DE ESTRUCTURAS MICROSCÓPICAS,12,FALSO,FALSO,FALSO
TECNICO,TECNICO ESPECIALIZADO B,TÉCNICO EN MANTENIMIENTO DE EQUIPO DE LABORATORIO,72,FALSO,FALSO,FALSO
TECNICO,TECNICO ESPECIALIZADO B,TÉCNICO EN MANTENIMIENTO DE EQUIPO E INSTALACIONES,24,FALSO,FALSO,FALSO
TECNICO,TECNICO ESPECIALIZADO B,"TÉCNICO EN MANTENIMIENTO DE EQUIPOS DE SISMOLOGÍA, VULCANOLOGÍA Y EXPLORACIÓN GEOFÍSICA",12,FALSO,FALSO,FALSO
TECNICO,TECNICO ESPECIALIZADO B,TÉCNICO EN MECÁNICA AUTOMOTRIZ,70,FALSO,FALSO,FALSO
TECNICO,TECNICO ESPECIALIZADO B,TÉCNICO EN PAGO DE DESIGNACIONES,24,FALSO,FALSO,FALSO
TECNICO,TECNICO ESPECIALIZADO B,TÉCNICO EN PROCESOS ELECTORALES,10,FALSO,FALSO,FALSO
TECNICO,TECNICO ESPECIALIZADO B,TÉCNICO EN RECONOCIMIENTO DE ESTUDIOS,36,FALSO,FALSO,FALSO
TECNICO,TECNICO ESPECIALIZADO B,TÉCNICO EN SERVICIOS DE LABORATORIO,48,FALSO,FALSO,FALSO
TECNICO,TECNICO ESPECIALIZADO B,TÉCNICO EN SERVICIOS MULTIMEDIA,224,FALSO,FALSO,FALSO
TECNICO,TECNICO ESPECIALIZADO B,TÉCNICO EN SERVICIOS MULTIMEDIA E INFORMÁTICOS,24,FALSO,FALSO,FALSO
TECNICO,TECNICO ESPECIALIZADO B,TÉCNICO EN SISTEMAS DE SEGURIDAD ELECTRÓNICA,45,FALSO,FALSO,FALSO
TECNICO,TECNICO ESPECIALIZADO B,TÉCNICO EN SONIDO TELEVISIVO,24,FALSO,FALSO,FALSO
TECNICO,TECNICO ESPECIALIZADO B,TÉCNICO EN TOPOGRAFÍA,9,FALSO,FALSO,FALSO
TECNICO,TECNICO ESPECIALIZADO B,TÉCNICO EN TRÁMITE DE PAGO DE FACTURAS,9,FALSO,FALSO,FALSO
TECNICO,TECNICO ESPECIALIZADO B,TÉCNICO EN TRÁMITES DE PERSONAL DOCENTE,5,FALSO,FALSO,FALSO
TECNICO,TECNICO ESPECIALIZADO B,TÉCNICO EN VERIFICACIÓN DE RECURSOS BIBLIOGRÁFICOS,9,FALSO,FALSO,FALSO
TECNICO,TECNICO ESPECIALIZADO B,TÉCNICO ENCARGADO DE EQUIPO AUDIOVISUAL Y DE SIMULACIÓN CLÍNICA,12,FALSO,FALSO,FALSO
TECNICO,TECNICO ESPECIALIZADO C,,90,FALSO,FALSO,FALSO
TECNICO,TECNICO ESPECIALIZADO C,BAILARÍN,111,FALSO,FALSO,FALSO
TECNICO,TECNICO ESPECIALIZADO C,INTÉRPRETE DE LENGUA DE SEÑAS COSTARRICENSE,29,FALSO,FALSO,FALSO
TECNICO,TECNICO ESPECIALIZADO C,TÉCNICO COORDINADOR DE ALMACÉN DE MATERIALES Y HERRAMIENTAS,12,FALSO,FALSO,FALSO
TECNICO,TECNICO ESPECIALIZADO C,TÉCNICO DE CONTROL DE TRATAMIENTO CLÍNICO,24,FALSO,FALSO,FALSO
TECNICO,TECNICO ESPECIALIZADO C,TÉCNICO EN ACTIVOS FIJOS,12,FALSO,FALSO,FALSO
TECNICO,TECNICO ESPECIALIZADO C,TÉCNICO EN APOYO A INGENIERÍA ELÉCTRICA,12,FALSO,FALSO,FALSO
TECNICO,TECNICO ESPECIALIZADO C,TÉCNICO EN APOYO A LA DOCENCIA EN PRODUCCIÓN AUDIOVISUAL,60,FALSO,FALSO,FALSO
TECNICO,TECNICO ESPECIALIZADO C,TÉCNICO EN APOYO A LA PRESERVACIÓN DE LA RED DE COLECCIONES NATURALES,12,FALSO,FALSO,FALSO
TECNICO,TECNICO ESPECIALIZADO C,TÉCNICO EN APOYO ADMINISTRATIVO A LA PRUEBA DE APTITUD ACADÉMICA,12,FALSO,FALSO,FALSO
TECNICO,TECNICO ESPECIALIZADO C,TÉCNICO EN APOYO ADMINISTRATIVO AL CASED,12,FALSO,FALSO,FALSO
TECNICO,TECNICO ESPECIALIZADO C,TÉCNICO EN APOYO AL PROCESO ADMINISTRATIVO DE VICERRECTORÍA,60,FALSO,FALSO,FALSO
TECNICO,TECNICO ESPECIALIZADO C,TÉCNICO EN APOYO AL SISTEMA DE GESTIÓN DE LA CALIDAD Y DESEMPEÑO.,1,FALSO,FALSO,FALSO
TECNICO,TECNICO ESPECIALIZADO C,TÉCNICO EN ARCHIVO UNIVERSITARIO,24,FALSO,FALSO,FALSO
TECNICO,TECNICO ESPECIALIZADO C,TÉCNICO EN ARCHIVÍSTICA,229,FALSO,FALSO,FALSO
TECNICO,TECNICO ESPECIALIZADO C,TÉCNICO EN CATALOGACIÓN,46,FALSO,FALSO,FALSO
TECNICO,TECNICO ESPECIALIZADO C,TÉCNICO EN CATALOGACIÓN Y ADQUISICIÓN DE RECURSOS BIBLIOGRÁFICOS DE SEDE,64,FALSO,FALSO,FALSO
TECNICO,TECNICO ESPECIALIZADO C,TÉCNICO EN CONTROL INTERNO DE RECURSOS HUMANOS,48,FALSO,FALSO,FALSO
TECNICO,TECNICO ESPECIALIZADO C,TÉCNICO EN EDUCACIÓN PREESCOLAR,93,FALSO,FALSO,FALSO
TECNICO,TECNICO ESPECIALIZADO C,TÉCNICO EN LENGUAS AUTÓCTONAS,12,FALSO,FALSO,FALSO
TECNICO,TECNICO ESPECIALIZADO C,TÉCNICO EN REVISIÓN DE EQUIPO,13,FALSO,FALSO,FALSO
TECNICO,TECNICO ESPECIALIZADO C,TÉCNICO EN SALUD AMBIENTAL,11,FALSO,FALSO,FALSO
TECNICO,TECNICO ESPECIALIZADO C,TÉCNICO EN SERVICIOS DE VIDEOTECA,12,FALSO,FALSO,FALSO
TECNICO,TECNICO ESPECIALIZADO C,TÉCNICO EN TRÁMITE DE BECAS AL EXTERIOR,45,FALSO,FALSO,FALSO
TECNICO,TECNICO ESPECIALIZADO C,TÉCNICO EN TRÁMITE DE CONVENIOS Y LOGÍSTICA,4,FALSO,FALSO,FALSO
TECNICO,TECNICO ESPECIALIZADO C,TÉCNICO EN TRÁMITES DE VIÁTICOS AL EXTERIOR,24,FALSO,FALSO,FALSO
TECNICO,TECNICO ESPECIALIZADO C,TÉCNICO EN TRÁMITES INSTITUCIONALES DE RECTORÍA,12,FALSO,FALSO,FALSO
TECNICO,TECNICO ESPECIALIZADO D,,451,FALSO,FALSO,FALSO
TECNICO,TECNICO ESPECIALIZADO D,CAMARÓGRAFO,52,FALSO,FALSO,FALSO
TECNICO,TECNICO ESPECIALIZADO D,EDITOR DE PRODUCCIONES AUDIOVISUALES,21,FALSO,FALSO,FALSO
TECNICO,TECNICO ESPECIALIZADO D,ENCARGADO DE BODEGA DE MATERIALES ODONTOLÓGICOS,10,FALSO,FALSO,FALSO
TECNICO,TECNICO ESPECIALIZADO D,ENCARGADO DE SERVICIOS ADMINISTRATIVOS DE CENTRO,201,FALSO,FALSO,FALSO
TECNICO,TECNICO ESPECIALIZADO D,ENCARGADO DE SERVICIOS ADMINISTRATIVOS DE OFICINA,128,FALSO,FALSO,FALSO
TECNICO,TECNICO ESPECIALIZADO D,ENCARGADO DE SERVICIOS ADMINISTRATIVOS DE RECINTO,12,FALSO,FALSO,FALSO
TECNICO,TECNICO ESPECIALIZADO D,ENCARGADO DE TRÁMITES DE RECURSOS HUMANOS DE SEDE,48,FALSO,FALSO,FALSO
TECNICO,TECNICO ESPECIALIZADO D,JEFATURA ADMINISTRATIVA A DE CENTRO,12,FALSO,FALSO,FALSO
TECNICO,TECNICO ESPECIALIZADO D,LOCUTOR,90,FALSO,FALSO,FALSO
TECNICO,TECNICO ESPECIALIZADO D,PROFESIONAL EN DESARROLLO DE APLICACIONES WEB Y MANTENIMIENTO DE EQUIPO EN EL LABORATORIO DE INGENIERÍA SÍSMICA,12,FALSO,FALSO,FALSO
TECNICO,TECNICO ESPECIALIZADO D,PROFESIONAL EN GESTIÓN DEL DESEMPEÑO,12,FALSO,FALSO,FALSO
TECNICO,TECNICO ESPECIALIZADO D,PROFESIONAL EN SALUD OCUPACIONAL,12,FALSO,FALSO,FALSO
TECNICO,TECNICO ESPECIALIZADO D,REALIZADOR,26,FALSO,FALSO,FALSO
TECNICO,TECNICO ESPECIALIZADO D,SECRETARIA EJECUTIVA DE RECTORÍA Y CONSEJO UNIVERSITARIO,48,FALSO,FALSO,FALSO
TECNICO,TECNICO ESPECIALIZADO D,TÉCNICO COORDINADOR DE ALMACENAMIENTO Y DISTRIBUCIÓN,5,FALSO,FALSO,FALSO
TECNICO,TECNICO ESPECIALIZADO D,TÉCNICO COORDINADOR DE ASISTENCIA DENTAL,12,FALSO,FALSO,FALSO
TECNICO,TECNICO ESPECIALIZADO D,TÉCNICO COORDINADOR DE ASUNTOS DELICITIVOS,12,FALSO,FALSO,FALSO
TECNICO,TECNICO ESPECIALIZADO D,TÉCNICO COORDINADOR DE AUDIO,12,FALSO,FALSO,FALSO
TECNICO,TECNICO ESPECIALIZADO D,TÉCNICO COORDINADOR DE GRUPO ARTÍSTICO,26,FALSO,FALSO,FALSO
TECNICO,TECNICO ESPECIALIZADO D,TÉCNICO COORDINADOR DE MANTENIMIENTO,234,FALSO,FALSO,FALSO
TECNICO,TECNICO ESPECIALIZADO D,TÉCNICO COORDINADOR DE MANTENIMIENTO AUTOMOTRIZ,24,FALSO,FALSO,FALSO
TECNICO,TECNICO ESPECIALIZADO D,TÉCNICO COORDINADOR DEL CENTRO DE PRODUCCIÓN AUDIOVISUAL,12,FALSO,FALSO,FALSO
TECNICO,TECNICO ESPECIALIZADO D,TÉCNICO COORDINADOR DEL SERVICIO DE ESTERILIZACIÓN,9,FALSO,FALSO,FALSO
TECNICO,TECNICO ESPECIALIZADO D,TÉCNICO COORDINADOR EN DIBUJO DE PLANOS CONSTRUCTIVOS,12,FALSO,FALSO,FALSO
TECNICO,TECNICO ESPECIALIZADO D,TÉCNICO COORDINADOR EN SISTEMAS DE SEGURIDAD ELECTRÓNICA,12,FALSO,FALSO,FALSO
TECNICO,TECNICO ESPECIALIZADO D,TÉCNICO DE ASUNTOS ESTUDIANTILES DE RECINTO,12,FALSO,FALSO,FALSO
TECNICO,TECNICO ESPECIALIZADO D,TÉCNICO DE LABORATORIO CLÍNICO,15,FALSO,FALSO,FALSO
TECNICO,TECNICO ESPECIALIZADO D,TÉCNICO DE LABORATORIO DE ANÁLISIS CLÍNICOS,48,FALSO,FALSO,FALSO
TECNICO,TECNICO ESPECIALIZADO D,TÉCNICO DE LABORATORIO DE FÓSILES,12,FALSO,FALSO,FALSO
TECNICO,TECNICO ESPECIALIZADO D,TÉCNICO DE LABORATORIO DE PRODUCTOS FORESTALES,12,FALSO,FALSO,FALSO
TECNICO,TECNICO ESPECIALIZADO D,TÉCNICO DE LABORATORIO DE TÉCNICAS MOLECULARES,11,FALSO,FALSO,FALSO
TECNICO,TECNICO ESPECIALIZADO D,TÉCNICO DE LABORATORIO EN BIOLOGÍA GENÉTICA,60,FALSO,FALSO,FALSO
TECNICO,TECNICO ESPECIALIZADO D,TÉCNICO DE LABORATORIO EN BIOTECNOLOGÍA,24,FALSO,FALSO,FALSO
TECNICO,TECNICO ESPECIALIZADO D,TÉCNICO DE LABORATORIO EN BROMATOLOGÍA,12,FALSO,FALSO,FALSO
TECNICO,TECNICO ESPECIALIZADO D,TÉCNICO DE LABORATORIO EN CALIDAD DE MEDICAMENTOS,36,FALSO,FALSO,FALSO
TECNICO,TECNICO ESPECIALIZADO D,TÉCNICO DE LABORATORIO EN CONTROL DE CALIDAD,24,FALSO,FALSO,FALSO
TECNICO,TECNICO ESPECIALIZADO D,TÉCNICO DE LABORATORIO EN ENSAYOS BIOLÓGICOS,10,FALSO,FALSO,FALSO
TECNICO,TECNICO ESPECIALIZADO D,TÉCNICO DE LABORATORIO EN ENSAYOS DE RECURSOS NATURALES,24,FALSO,FALSO,FALSO
TECNICO,TECNICO ESPECIALIZADO D,TÉCNICO DE LABORATORIO EN FARMACIA,21,FALSO,FALSO,FALSO
TECNICO,TECNICO ESPECIALIZADO D,TÉCNICO DE LABORATORIO EN FITOPATOLOGÍA,12,FALSO,FALSO,FALSO
TECNICO,TECNICO ESPECIALIZADO D,TÉCNICO DE LABORATORIO EN INGENIERÍA MARÍTIMA,12,FALSO,FALSO,FALSO
TECNICO,TECNICO ESPECIALIZADO D,TÉCNICO DE LABORATORIO EN INGENIERÍA MECÁNICA,12,FALSO,FALSO,FALSO
TECNICO,TECNICO ESPECIALIZADO D,TÉCNICO DE LABORATORIO EN MANEJO DE PATÓGENOS Y TÉCNICAS MOLECULARES,12,FALSO,FALSO,FALSO
TECNICO,TECNICO ESPECIALIZADO D,TÉCNICO DE LABORATORIO EN MICROBIOLOGÍA,48,FALSO,FALSO,FALSO
TECNICO,TECNICO ESPECIALIZADO D,TÉCNICO DE LABORATORIO EN PROCESAMIENTO DE PLASMA,12,FALSO,FALSO,FALSO
TECNICO,TECNICO ESPECIALIZADO D,TÉCNICO DE LABORATORIO EN RADIOQUÍMICA,12,FALSO,FALSO,FALSO
TECNICO,TECNICO ESPECIALIZADO D,TÉCNICO DE LABORATORIO EN SERVICIOS ANALÍTICOS,12,FALSO,FALSO,FALSO
TECNICO,TECNICO ESPECIALIZADO D,TÉCNICO DE LABORATORIO EN VIROLOGÍA MÉDICA,24,FALSO,FALSO,FALSO
TECNICO,TECNICO ESPECIALIZADO D,TÉCNICO EN ABOGACÍA,12,FALSO,FALSO,FALSO
TECNICO,TECNICO ESPECIALIZADO D,TÉCNICO EN ADQUISICIÓN DE BIENES Y SERVICIOS POR COMPRA DIRECTA,12,FALSO,FALSO,FALSO
TECNICO,TECNICO ESPECIALIZADO D,TÉCNICO EN ADQUISICIÓN DE BIENES Y SERVICIOS POR FONDOS DE TRABAJO,112,FALSO,FALSO,FALSO
TECNICO,TECNICO ESPECIALIZADO D,TÉCNICO EN ANÁLISIS MICROBIOLÓGICO DE ALIMENTOS PARA ANIMALES,12,FALSO,FALSO,FALSO
TECNICO,TECNICO ESPECIALIZADO D,TÉCNICO EN APOYO A DIRECCIÓN DE SEDE,24,FALSO,FALSO,FALSO
TECNICO,TECNICO ESPECIALIZADO D,TÉCNICO EN APOYO A INVESTIGACIONES FARMACÉUTICAS,11,FALSO,FALSO,FALSO
TECNICO,TECNICO ESPECIALIZADO D,TÉCNICO EN APOYO A LA DIRECCIÓN DE MEGAPROYECTOS,12,FALSO,FALSO,FALSO
TECNICO,TECNICO ESPECIALIZADO D,TÉCNICO EN APOYO A LA INVESTIGACIÓN DEL SERPENTARIO,11,FALSO,FALSO,FALSO
TECNICO,TECNICO ESPECIALIZADO D,TÉCNICO EN APOYO A LA INVESTIGACIÓN EN BIOTECNOLOGÍA DE PLANTAS,12,FALSO,FALSO,FALSO
TECNICO,TECNICO ESPECIALIZADO D,TÉCNICO EN APOYO A LA INVESTIGACIÓN MARINA,12,FALSO,FALSO,FALSO
TECNICO,TECNICO ESPECIALIZADO D,TÉCNICO EN APOYO A LA INVESTIGACIÓN Y PRESERVACIÓN DE ÁREAS PROTEGIDAS,12,FALSO,FALSO,FALSO
TECNICO,TECNICO ESPECIALIZADO D,TÉCNICO EN APOYO ADMINISTRATIVO A EDICIÓN DE REVISTA,26,FALSO,FALSO,FALSO
TECNICO,TECNICO ESPECIALIZADO D,TÉCNICO EN APOYO FINANCIERO DE SEDE,5,FALSO,FALSO,FALSO
TECNICO,TECNICO ESPECIALIZADO D,TÉCNICO EN APROVISIONAMIENTO INFORMÁTICO,36,FALSO,FALSO,FALSO
TECNICO,TECNICO ESPECIALIZADO D,TÉCNICO EN ASISTENCIA EDITORIAL,12,FALSO,FALSO,FALSO
TECNICO,TECNICO ESPECIALIZADO D,TÉCNICO EN ASTRONOMÍA OBSERVACIONAL,12,FALSO,FALSO,FALSO
TECNICO,TECNICO ESPECIALIZADO D,TÉCNICO EN BECAS Y BENEFICIOS COMPLEMENTARIOS DE SEDE,24,FALSO,FALSO,FALSO
TECNICO,TECNICO ESPECIALIZADO D,TÉCNICO EN COBROS ESTUDIANTILES,48,FALSO,FALSO,FALSO
TECNICO,TECNICO ESPECIALIZADO D,TÉCNICO EN COMPRA DE BIENES AL EXTERIOR,12,FALSO,FALSO,FALSO
TECNICO,TECNICO ESPECIALIZADO D,TÉCNICO EN COMPRAS ESPECIALIZADAS DE SEDE,48,FALSO,FALSO,FALSO
TECNICO,TECNICO ESPECIALIZADO D,TÉCNICO EN COMPUTACIÓN E INFORMÁTICA,1095,FALSO,FALSO,FALSO
TECNICO,TECNICO ESPECIALIZADO D,TÉCNICO EN CONTABILIDAD,12,FALSO,FALSO,FALSO
TECNICO,TECNICO ESPECIALIZADO D,TÉCNICO EN CONTROL DE COBRO DE SERVICIOS ODONTOLÓGICOS,12,FALSO,FALSO,FALSO
TECNICO,TECNICO ESPECIALIZADO D,TÉCNICO EN CONTROL DE DISTRIBUCIÓN Y COBRO DEL SEMANARIO UNIVERSIDAD,12,FALSO,FALSO,FALSO
TECNICO,TECNICO ESPECIALIZADO D,TÉCNICO EN CONTROL DE EJECUCIÓN PRESUPUESTARIA DE RECTORÍA,36,FALSO,FALSO,FALSO
TECNICO,TECNICO ESPECIALIZADO D,TÉCNICO EN CONTROL DE INGRESOS,33,FALSO,FALSO,FALSO
TECNICO,TECNICO ESPECIALIZADO D,TÉCNICO EN CONTROL DE PAGOS,60,FALSO,FALSO,FALSO
TECNICO,TECNICO ESPECIALIZADO D,TÉCNICO EN CONTROL DE PLAZAS DEL PRESUPUESTO ORDINARIO,12,FALSO,FALSO,FALSO
TECNICO,TECNICO ESPECIALIZADO D,TÉCNICO EN CONTROL DE TRANSFERENCIAS ELECTRÓNICAS,24,FALSO,FALSO,FALSO
TECNICO,TECNICO ESPECIALIZADO D,TÉCNICO EN CONTROL INTERNO DE OAF,24,FALSO,FALSO,FALSO
TECNICO,TECNICO ESPECIALIZADO D,TÉCNICO EN CONTROL PRESUPUESTARIO DE PROYECTOS ESPECIALES,50,FALSO,FALSO,FALSO
TECNICO,TECNICO ESPECIALIZADO D,TÉCNICO EN CONTROL PRESUPUESTARIO DE VIDA ESTUDIANTIL,12,FALSO,FALSO,FALSO
TECNICO,TECNICO ESPECIALIZADO D,TÉCNICO EN DISEÑO DE REDES,11,FALSO,FALSO,FALSO
TECNICO,TECNICO ESPECIALIZADO D,"TÉCNICO EN DISEÑO GRÁFICO, WEB Y MULTIMEDIA",31,FALSO,FALSO,FALSO
TECNICO,TECNICO ESPECIALIZADO D,TÉCNICO EN EMERGENCIAS MÉDICAS,47,FALSO,FALSO,FALSO
TECNICO,TECNICO ESPECIALIZADO D,TÉCNICO EN EQUIPO DE LABORATORIO QUÍMICO,12,FALSO,FALSO,FALSO
TECNICO,TECNICO ESPECIALIZADO D,TÉCNICO EN ESTRUCTURAS DENTALES,65,FALSO,FALSO,FALSO
TECNICO,TECNICO ESPECIALIZADO D,TÉCNICO EN EVALUACIÓN DE SERVICIOS,12,FALSO,FALSO,FALSO
TECNICO,TECNICO ESPECIALIZADO D,TÉCNICO EN EXPEDIENTES ACADÉMICOS,20,FALSO,FALSO,FALSO
TECNICO,TECNICO ESPECIALIZADO D,TÉCNICO EN FONDOS DE VÍNCULO EXTERNO,34,FALSO,FALSO,FALSO
TECNICO,TECNICO ESPECIALIZADO D,TÉCNICO EN FONDOS DE VÍNCULOS EXTERNO DE CONARE,32,FALSO,FALSO,FALSO
TECNICO,TECNICO ESPECIALIZADO D,TÉCNICO EN GESTIÓN ADMINISTRATIVA DE RIFED,12,FALSO,FALSO,FALSO
TECNICO,TECNICO ESPECIALIZADO D,TÉCNICO EN GESTIÓN ADMINISTRATIVA DEL RECINTO DE GOLFITO,12,FALSO,FALSO,FALSO
TECNICO,TECNICO ESPECIALIZADO D,TÉCNICO EN GESTIÓN ADUANERA,12,FALSO,FALSO,FALSO
TECNICO,TECNICO ESPECIALIZADO D,TÉCNICO EN GESTIÓN DE RIESGO Y SEGURIDAD INFORMÁTICA,12,FALSO,FALSO,FALSO
TECNICO,TECNICO ESPECIALIZADO D,TÉCNICO EN GESTIÓN FINANCIERA,24,FALSO,FALSO,FALSO
TECNICO,TECNICO ESPECIALIZADO D,TÉCNICO EN GESTIÓN FINANCIERA DE SEDE,36,FALSO,FALSO,FALSO
TECNICO,TECNICO ESPECIALIZADO D,TÉCNICO EN GESTIÓN Y SEGUIMIENTO DE PROYECTOS,12,FALSO,FALSO,FALSO
TECNICO,TECNICO ESPECIALIZADO D,TÉCNICO EN GRABACIÓN Y SONIDO RADIOFÓNICO,48,FALSO,FALSO,FALSO
TECNICO,TECNICO ESPECIALIZADO D,TÉCNICO EN GRADUACIONES,11,FALSO,FALSO,FALSO
TECNICO,TECNICO ESPECIALIZADO D,TÉCNICO EN GUÍA DE HORARIOS Y CURSOS,12,FALSO,FALSO,FALSO
TECNICO,TECNICO ESPECIALIZADO D,TÉCNICO EN INVESTIGACIÓN PARA LA PRESERVACIÓN DE COLECCIONES NATURALES,12,FALSO,FALSO,FALSO
TECNICO,TECNICO ESPECIALIZADO D,TÉCNICO EN MANTENIMIENTO DE EQUIPO E INSTALACIONES ELECTROMECÁNICAS,24,FALSO,FALSO,FALSO
TECNICO,TECNICO ESPECIALIZADO D,TÉCNICO EN MANTENIMIENTO DE EQUIPO RADIOFÓNICO,3,FALSO,FALSO,FALSO
TECNICO,TECNICO ESPECIALIZADO D,TÉCNICO EN MANTENIMIENTO DE EQUIPO TELEVISIVO,24,FALSO,FALSO,FALSO
TECNICO,TECNICO ESPECIALIZADO D,TÉCNICO EN MANTENIMIENTO DE REDES DE TELECOMUNICACIONES,65,FALSO,FALSO,FALSO
TECNICO,TECNICO ESPECIALIZADO D,TÉCNICO EN MATRÍCULA ESTUDIANTIL,12,FALSO,FALSO,FALSO
TECNICO,TECNICO ESPECIALIZADO D,TÉCNICO EN MECÁNICA DE PRECISIÓN Y SOLDADURA,36,FALSO,FALSO,FALSO
TECNICO,TECNICO ESPECIALIZADO D,TÉCNICO EN METROLOGÍA,24,FALSO,FALSO,FALSO
TECNICO,TECNICO ESPECIALIZADO D,TÉCNICO EN MICROBIOLOGÍA DE ALIMENTOS Y AGUAS,12,FALSO,FALSO,FALSO
TECNICO,TECNICO ESPECIALIZADO D,TÉCNICO EN MODIFICACIONES PRESUPUESTARIAS,24,FALSO,FALSO,FALSO
TECNICO,TECNICO ESPECIALIZADO D,TÉCNICO EN ORIENTACIÓN SOBRE TRÁMITES DE PENSIÓN,12,FALSO,FALSO,FALSO
TECNICO,TECNICO ESPECIALIZADO D,TÉCNICO EN ORIENTACIÓN Y CAPACITACIÓN EN ESTUDIOS DE POSGRADOS,12,FALSO,FALSO,FALSO
TECNICO,TECNICO ESPECIALIZADO D,TÉCNICO EN PAGO DE BECAS AL EXTERIOR,12,FALSO,FALSO,FALSO
TECNICO,TECNICO ESPECIALIZADO D,TÉCNICO EN PERIODISMO,11,FALSO,FALSO,FALSO
TECNICO,TECNICO ESPECIALIZADO D,TÉCNICO EN PROCESOS INSTRUCCIONALES DE HOSTIGAMIENTO SEXUAL,12,FALSO,FALSO,FALSO
TECNICO,TECNICO ESPECIALIZADO D,TÉCNICO EN PRODUCCIÓN DE DANZA,12,FALSO,FALSO,FALSO
TECNICO,TECNICO ESPECIALIZADO D,TÉCNICO EN PROGRAMACIÓN Y TRANSMISIÓN TELEVISIVA,12,FALSO,FALSO,FALSO
TECNICO,TECNICO ESPECIALIZADO D,TÉCNICO EN RECLUTAMIENTO Y SELECCIÓN DE PERSONAL,36,FALSO,FALSO,FALSO
TECNICO,TECNICO ESPECIALIZADO D,TÉCNICO EN REGISTROS CONTABLES,70,FALSO,FALSO,FALSO
TECNICO,TECNICO ESPECIALIZADO D,TÉCNICO EN SERVICIOS DE FONOTECA Y PROGRAMACIÓN RADIOFÓNICA AUTOMATIZADA,12,FALSO,FALSO,FALSO
TECNICO,TECNICO ESPECIALIZADO D,TÉCNICO EN SISTEMAS TELEFÓNICOS,12,FALSO,FALSO,FALSO
TECNICO,TECNICO ESPECIALIZADO D,TÉCNICO EN SOPLADO DE VIDRIO,7,FALSO,FALSO,FALSO
TECNICO,TECNICO ESPECIALIZADO D,TÉCNICO EN TRÁMITES DE BECAS CORTAS AL EXTERIOR,12,FALSO,FALSO,FALSO
TECNICO,TECNICO ESPECIALIZADO D,TÉCNICO EN TRÁMITES DE VENTA,12,FALSO,FALSO,FALSO
TECNICO,TECNICO ESPECIALIZADO D,TÉCNICO ENCARGADO DE PROGRAMA DE POSGRADO,24,FALSO,FALSO,FALSO
TECNICO,TECNICO ESPECIALIZADO D,TÉCNICO ESPECIALIZADO EN ENSAYOS DE INFRAESTRUCTURAS CIVIL Y VIAL,257,FALSO,FALSO,FALSO
TECNICO,TECNICO ESPECIALIZADO D,TÉCNICO INSTRUCTOR DEL PROGRAMA DE ASISTENCIA DENTAL,36,FALSO,FALSO,FALSO
